{
  "schemaVersion": 2,
  "contractVersion": "2.0.0",
  "publicationId": "commercial-catalog-initial-v2",
  "publishedAt": "2026-08-24T06:00:00.000Z",
  "market": {
    "country": "MX",
    "currency": "MXN",
    "timezone": "America/Mexico_City",
    "taxLabel": "IVA",
    "taxRateBasisPoints": 1600
  },
  "products": [
    {
      "code": "FREE",
      "slug": "free",
      "kind": "PLAN",
      "name": "Free",
      "description": "Herramientas esenciales para empezar con Avoqado.",
      "salesMode": "SELF_SERVICE",
      "sortOrder": 10,
      "capabilityBindings": [
        { "capabilityCode": "CHATBOT", "capabilityKind": "FEATURE", "activationRequirement": { "mode": "NOT_REQUIRED" } }
      ],
      "prices": [
        {
          "code": "FREE_MONTHLY",
          "billingUnit": "VENUE_MONTH",
          "amount": "0.00",
          "currency": "MXN",
          "taxBehavior": "NOT_APPLICABLE",
          "taxRateBasisPoints": 0
        },
        {
          "code": "FREE_ANNUAL",
          "billingUnit": "VENUE_YEAR",
          "amount": "0.00",
          "currency": "MXN",
          "taxBehavior": "NOT_APPLICABLE",
          "taxRateBasisPoints": 0
        }
      ]
    },
    {
      "code": "PRO",
      "slug": "pro",
      "kind": "PLAN",
      "name": "Pro",
      "description": "Operación y crecimiento para negocios que quieren más control.",
      "salesMode": "SELF_SERVICE",
      "sortOrder": 20,
      "capabilityBindings": [
        { "capabilityCode": "ADVANCED_REPORTS", "capabilityKind": "FEATURE", "activationRequirement": { "mode": "NOT_REQUIRED" } },
        { "capabilityCode": "AI_ASSISTANT_BUBBLE", "capabilityKind": "FEATURE", "activationRequirement": { "mode": "NOT_REQUIRED" } },
        { "capabilityCode": "AREA_TICKETS", "capabilityKind": "FEATURE", "activationRequirement": { "mode": "NOT_REQUIRED" } },
        { "capabilityCode": "AVAILABLE_BALANCE", "capabilityKind": "FEATURE", "activationRequirement": { "mode": "NOT_REQUIRED" } },
        { "capabilityCode": "BANKING_HUB", "capabilityKind": "FEATURE", "activationRequirement": { "mode": "NOT_REQUIRED" } },
        { "capabilityCode": "BANK_RECONCILIATION", "capabilityKind": "FEATURE", "activationRequirement": { "mode": "NOT_REQUIRED" } },
        {
          "capabilityCode": "CASH_RECONCILIATION",
          "capabilityKind": "FEATURE",
          "activationRequirement": { "mode": "VENUE_SETTING", "settingKey": "cashReconciliationEnabled", "defaultState": "OFF" }
        },
        { "capabilityCode": "CHATBOT", "capabilityKind": "FEATURE", "activationRequirement": { "mode": "NOT_REQUIRED" } },
        { "capabilityCode": "GOOGLE_REVIEW_REDIRECT", "capabilityKind": "FEATURE", "activationRequirement": { "mode": "NOT_REQUIRED" } },
        { "capabilityCode": "LOYALTY_PROGRAM", "capabilityKind": "FEATURE", "activationRequirement": { "mode": "NOT_REQUIRED" } },
        { "capabilityCode": "ONLINE_ORDERING", "capabilityKind": "FEATURE", "activationRequirement": { "mode": "NOT_REQUIRED" } },
        { "capabilityCode": "PROMOTIONS", "capabilityKind": "FEATURE", "activationRequirement": { "mode": "NOT_REQUIRED" } },
        { "capabilityCode": "REFERRAL_PROGRAM", "capabilityKind": "FEATURE", "activationRequirement": { "mode": "NOT_REQUIRED" } },
        { "capabilityCode": "RESERVATIONS", "capabilityKind": "FEATURE", "activationRequirement": { "mode": "NOT_REQUIRED" } },
        { "capabilityCode": "TABLE_SERVICE", "capabilityKind": "FEATURE", "activationRequirement": { "mode": "NOT_REQUIRED" } },
        { "capabilityCode": "UPSELL", "capabilityKind": "FEATURE", "activationRequirement": { "mode": "NOT_REQUIRED" } },
        { "capabilityCode": "VARIABLE_WEIGHT_BARCODE", "capabilityKind": "FEATURE", "activationRequirement": { "mode": "NOT_REQUIRED" } },
        { "capabilityCode": "VENUE_AUDIT_LOG", "capabilityKind": "FEATURE", "activationRequirement": { "mode": "NOT_REQUIRED" } }
      ],
      "prices": [
        {
          "code": "PRO_MONTHLY",
          "billingUnit": "VENUE_MONTH",
          "amount": "999.00",
          "currency": "MXN",
          "taxBehavior": "EXCLUSIVE",
          "taxRateBasisPoints": 1600
        },
        {
          "code": "PRO_ANNUAL",
          "billingUnit": "VENUE_YEAR",
          "amount": "9990.00",
          "currency": "MXN",
          "taxBehavior": "EXCLUSIVE",
          "taxRateBasisPoints": 1600
        }
      ]
    },
    {
      "code": "PREMIUM",
      "slug": "premium",
      "kind": "PLAN",
      "name": "Premium",
      "description": "Automatización, control avanzado y operación multicanal.",
      "salesMode": "SELF_SERVICE",
      "sortOrder": 30,
      "capabilityBindings": [
        { "capabilityCode": "ADVANCED_REPORTS", "capabilityKind": "FEATURE", "activationRequirement": { "mode": "NOT_REQUIRED" } },
        { "capabilityCode": "AI_ASSISTANT_BUBBLE", "capabilityKind": "FEATURE", "activationRequirement": { "mode": "NOT_REQUIRED" } },
        { "capabilityCode": "AREA_TICKETS", "capabilityKind": "FEATURE", "activationRequirement": { "mode": "NOT_REQUIRED" } },
        { "capabilityCode": "ATTENDANCE_TRACKING", "capabilityKind": "MODULE", "activationRequirement": { "mode": "NOT_REQUIRED" } },
        { "capabilityCode": "AUTO_REORDER", "capabilityKind": "FEATURE", "activationRequirement": { "mode": "NOT_REQUIRED" } },
        { "capabilityCode": "AVAILABLE_BALANCE", "capabilityKind": "FEATURE", "activationRequirement": { "mode": "NOT_REQUIRED" } },
        { "capabilityCode": "BANKING_HUB", "capabilityKind": "FEATURE", "activationRequirement": { "mode": "NOT_REQUIRED" } },
        { "capabilityCode": "BANK_RECONCILIATION", "capabilityKind": "FEATURE", "activationRequirement": { "mode": "NOT_REQUIRED" } },
        {
          "capabilityCode": "CASH_RECONCILIATION",
          "capabilityKind": "FEATURE",
          "activationRequirement": { "mode": "VENUE_SETTING", "settingKey": "cashReconciliationEnabled", "defaultState": "OFF" }
        },
        { "capabilityCode": "CFDI", "capabilityKind": "FEATURE", "activationRequirement": { "mode": "NOT_REQUIRED" } },
        { "capabilityCode": "CHATBOT", "capabilityKind": "FEATURE", "activationRequirement": { "mode": "NOT_REQUIRED" } },
        { "capabilityCode": "COMMISSIONS", "capabilityKind": "MODULE", "activationRequirement": { "mode": "NOT_REQUIRED" } },
        { "capabilityCode": "DELIVERY_CHANNELS", "capabilityKind": "FEATURE", "activationRequirement": { "mode": "NOT_REQUIRED" } },
        { "capabilityCode": "GOOGLE_REVIEW_REDIRECT", "capabilityKind": "FEATURE", "activationRequirement": { "mode": "NOT_REQUIRED" } },
        { "capabilityCode": "INVENTORY_TRACKING", "capabilityKind": "FEATURE", "activationRequirement": { "mode": "NOT_REQUIRED" } },
        { "capabilityCode": "LOYALTY_PROGRAM", "capabilityKind": "FEATURE", "activationRequirement": { "mode": "NOT_REQUIRED" } },
        { "capabilityCode": "MERCHANT_ROUTING_RULES", "capabilityKind": "FEATURE", "activationRequirement": { "mode": "NOT_REQUIRED" } },
        { "capabilityCode": "OFFLINE_LAN_HUB", "capabilityKind": "FEATURE", "activationRequirement": { "mode": "NOT_REQUIRED" } },
        { "capabilityCode": "ONLINE_ORDERING", "capabilityKind": "FEATURE", "activationRequirement": { "mode": "NOT_REQUIRED" } },
        { "capabilityCode": "PROMOTIONS", "capabilityKind": "FEATURE", "activationRequirement": { "mode": "NOT_REQUIRED" } },
        { "capabilityCode": "REFERRAL_PROGRAM", "capabilityKind": "FEATURE", "activationRequirement": { "mode": "NOT_REQUIRED" } },
        { "capabilityCode": "RESERVATIONS", "capabilityKind": "FEATURE", "activationRequirement": { "mode": "NOT_REQUIRED" } },
        { "capabilityCode": "SCALE_INTEGRATION", "capabilityKind": "FEATURE", "activationRequirement": { "mode": "NOT_REQUIRED" } },
        { "capabilityCode": "SERIALIZED_INVENTORY", "capabilityKind": "MODULE", "activationRequirement": { "mode": "NOT_REQUIRED" } },
        { "capabilityCode": "TABLE_SERVICE", "capabilityKind": "FEATURE", "activationRequirement": { "mode": "NOT_REQUIRED" } },
        { "capabilityCode": "TRANSACTION_EXPORT", "capabilityKind": "FEATURE", "activationRequirement": { "mode": "NOT_REQUIRED" } },
        { "capabilityCode": "UPSELL", "capabilityKind": "FEATURE", "activationRequirement": { "mode": "NOT_REQUIRED" } },
        { "capabilityCode": "UPSELL_AI", "capabilityKind": "FEATURE", "activationRequirement": { "mode": "NOT_REQUIRED" } },
        { "capabilityCode": "VARIABLE_WEIGHT_BARCODE", "capabilityKind": "FEATURE", "activationRequirement": { "mode": "NOT_REQUIRED" } },
        { "capabilityCode": "VENUE_AUDIT_LOG", "capabilityKind": "FEATURE", "activationRequirement": { "mode": "NOT_REQUIRED" } }
      ],
      "prices": [
        {
          "code": "PREMIUM_MONTHLY",
          "billingUnit": "VENUE_MONTH",
          "amount": "1699.00",
          "currency": "MXN",
          "taxBehavior": "EXCLUSIVE",
          "taxRateBasisPoints": 1600
        },
        {
          "code": "PREMIUM_ANNUAL",
          "billingUnit": "VENUE_YEAR",
          "amount": "16990.00",
          "currency": "MXN",
          "taxBehavior": "EXCLUSIVE",
          "taxRateBasisPoints": 1600
        }
      ]
    },
    {
      "code": "ENTERPRISE",
      "slug": "enterprise",
      "kind": "PLAN",
      "name": "Enterprise",
      "description": "Implementación y capacidades acordadas para operaciones complejas.",
      "salesMode": "CONTACT",
      "sortOrder": 40,
      "capabilityBindings": [
        { "capabilityCode": "ADVANCED_REPORTS", "capabilityKind": "FEATURE", "activationRequirement": { "mode": "NOT_REQUIRED" } },
        { "capabilityCode": "AI_ASSISTANT_BUBBLE", "capabilityKind": "FEATURE", "activationRequirement": { "mode": "NOT_REQUIRED" } },
        { "capabilityCode": "AREA_TICKETS", "capabilityKind": "FEATURE", "activationRequirement": { "mode": "NOT_REQUIRED" } },